Document,Topic,Name,Representation,Representative_Docs,Top_n_words,Probability,Representative_document,orig_index,id,created_at
a and r rentals someone please check this number please i think its a legit company i know in the past it might be a scam but it seems like its a real company thank you,5,5_money_bank_power_company,"['money', 'bank', 'power', 'company', 'scammed', 'apartment', 'guy', 'spoofed', 'yes', 'sent']","['one more bank acc info used by scammers in intense 419 scam here you go one more bank acc this scammer is quite optimistic in getting his money use this informztion how ever you like scum deserves hell and no less bank name barclays bank plc bank address acorn hous', 'coned unpaid balance power shutoff threat scam robo dialed from spoofed number claims to be coned and your power will be turned off in 30 minutes unless you call the scammers number and presumably give them money these evil jerks needs to be pounded the num', 'pg e unpaid balance power shutoff threat scam robodialed from spoofed number claims to be pg e and your power will be turned off in 30 minutes unless you call the scammers number and presumably give them money evil scammer needs to be pounded the number le']",money - bank - power - company - scammed - apartment - guy - spoofed - yes - sent,1.0,False,66597,51981,2019-12-06 15:52:17
bobrtc is closing greetings this development is troubling to say the least so i ll get to it we are closing the accounts of people who are routinely posting problematic phone numbers we have noticed multiple entries of drug rehab a,7,7_bobrtc_bob_calls_add,"['bobrtc', 'bob', 'calls', 'add', 'non', 'phonebook', 'work', 'available', 'uk', 'connect']","['bobrtc question i opened bobrtc today and i were no longer able to add numbers i ve got 39322xp now my question how long does an account need to exist to add numbers it s a bit sad that there are not so much numbers on bobrtc bu', 'bobrtc is moving to a new site this weekend dec 21 bobrtc tel bobrtc has thwarted yet another takedown attempt this time an attacker went after godaddy the registrar of bobrtc live by sending bupkis complaints a few months ago a lawyer was haggling godaddy trying to pry owner', 'limited non toll free dialing available again on bobrtc we have some non toll free dialing available again on bobrtc this outage was due to losing an agreement to deliver traffic the previous outage of ntf 4 weeks ago had everything to do with what numbers were being di']",bobrtc - bob - calls - add - non - phonebook - work - available - uk - connect,1.0,False,66598,51980,2019-12-06 15:36:08
ssa scam easy target happy hunting,13,13_ssa_hunting ssa_happy hunting ssa_hunting,"['ssa', 'hunting ssa', 'happy hunting ssa', 'hunting', 'happy hunting', 'happy', 'active', 'active happy', 'active happy hunting', 'easy target']","['ssa scam onvoy ssa scam onvoy scammers active happy hunting', 'ssa scam active scammer happy hunting', 'ssa scam active scammer happy hunting']",ssa - hunting ssa - happy hunting ssa - hunting - happy hunting - happy - active - active happy - active happy hunting - easy target,1.0,False,66599,51979,2019-12-06 15:33:10
ssa scam just got a robo call from them googled the number it s listed as an ssa scam i m at work atm but i plan to mess with them once i get home til then the rest of you have at it,-1,-1_student_loan_student loan_got,"['student', 'loan', 'student loan', 'got', 'fake', 'support', 'free', 'just', 'voicemail', 'apple']","['student loan scam so i got a voicemail from sarah the message is as follows hi my name is sarah i ve been trying to reach you regarding your federal student loans your loan has been flagged for forgiveness approval which could eli', 'student loan scam just got a voicemail from julie with student loan enrollment program the message is as follows hi i m julie with the student loan enrollment program i wanted to contact you regarding the class action lawsuit agains', 'student loan scam just got a voicemail from julie with student loan enrollment program the message is as follows hi i m julie with the student loan enrollment program i wanted to contact you regarding the class action lawsuit agains']",student - loan - student loan - got - fake - support - free - just - voicemail - apple,0.462210735133469,False,66600,51978,2019-12-06 15:16:35
call tokens are being weird yesterday i shut down bobrtc with 78 call tokens left just logged in to find 156 call tokens in my name 156 can somebody please explain why this is happening thanks,7,7_bobrtc_bob_calls_add,"['bobrtc', 'bob', 'calls', 'add', 'non', 'phonebook', 'work', 'available', 'uk', 'connect']","['bobrtc question i opened bobrtc today and i were no longer able to add numbers i ve got 39322xp now my question how long does an account need to exist to add numbers it s a bit sad that there are not so much numbers on bobrtc bu', 'bobrtc is moving to a new site this weekend dec 21 bobrtc tel bobrtc has thwarted yet another takedown attempt this time an attacker went after godaddy the registrar of bobrtc live by sending bupkis complaints a few months ago a lawyer was haggling godaddy trying to pry owner', 'limited non toll free dialing available again on bobrtc we have some non toll free dialing available again on bobrtc this outage was due to losing an agreement to deliver traffic the previous outage of ntf 4 weeks ago had everything to do with what numbers were being di']",bobrtc - bob - calls - add - non - phonebook - work - available - uk - connect,0.8378331197673162,False,66601,51977,2019-12-06 14:54:37
dea scam answers as dea easy target,2,2_ssa_ssa ssa_indian_fake,"['ssa', 'ssa ssa', 'indian', 'fake', 'ms', 'ssa indian', 'ssa ssa ssa', 'indian fake', 'dea', 'fake ssa']","['ssa scam', 'ssa scam 12 18 19', 'ssa scam a ssa scam']",ssa - ssa ssa - indian - fake - ms - ssa indian - ssa ssa ssa - indian fake - dea - fake ssa,0.45145486869736656,False,66602,51976,2019-12-06 14:49:52
buyhealth scam their main site their support site,8,8_insurance_health_warranty_car,"['insurance', 'health', 'warranty', 'car', 'company', 'pills', 'health insurance', 'sell', 'keto', 'gohealth']","['high value insurance scam three automated messages from an issam hiring manager at family first life saying he got my application for a high value insurance policy on craigslist has been calling my desk phone at work and i don t use craigsli', 'health insurance scam', 'this is a shady car insurance company called protect my car offering free roadside assistance and 100 car maintenance coverage and insurance for 50 bucks a month plus a flexible down payment fee wh']",insurance - health - warranty - car - company - pills - health insurance - sell - keto - gohealth,1.0,False,66603,51975,2019-12-06 14:14:42
ssa scam,2,2_ssa_ssa ssa_indian_fake,"['ssa', 'ssa ssa', 'indian', 'fake', 'ms', 'ssa indian', 'ssa ssa ssa', 'indian fake', 'dea', 'fake ssa']","['ssa scam', 'ssa scam 12 18 19', 'ssa scam a ssa scam']",ssa - ssa ssa - indian - fake - ms - ssa indian - ssa ssa ssa - indian fake - dea - fake ssa,1.0,True,66604,51974,2019-12-06 14:06:35
your activity has been recorded email saying they have recorded proof of me doing criminal and illegal activities and have infected device with malware to various usb in hidden ways want btc and they ll delete it email,-1,-1_student_loan_student loan_got,"['student', 'loan', 'student loan', 'got', 'fake', 'support', 'free', 'just', 'voicemail', 'apple']","['student loan scam so i got a voicemail from sarah the message is as follows hi my name is sarah i ve been trying to reach you regarding your federal student loans your loan has been flagged for forgiveness approval which could eli', 'student loan scam just got a voicemail from julie with student loan enrollment program the message is as follows hi i m julie with the student loan enrollment program i wanted to contact you regarding the class action lawsuit agains', 'student loan scam just got a voicemail from julie with student loan enrollment program the message is as follows hi i m julie with the student loan enrollment program i wanted to contact you regarding the class action lawsuit agains']",student - loan - student loan - got - fake - support - free - just - voicemail - apple,0.4565780701746778,False,66605,51973,2019-12-06 12:54:53
this is scammer of quickbooks and other services website is,-1,-1_student_loan_student loan_got,"['student', 'loan', 'student loan', 'got', 'fake', 'support', 'free', 'just', 'voicemail', 'apple']","['student loan scam so i got a voicemail from sarah the message is as follows hi my name is sarah i ve been trying to reach you regarding your federal student loans your loan has been flagged for forgiveness approval which could eli', 'student loan scam just got a voicemail from julie with student loan enrollment program the message is as follows hi i m julie with the student loan enrollment program i wanted to contact you regarding the class action lawsuit agains', 'student loan scam just got a voicemail from julie with student loan enrollment program the message is as follows hi i m julie with the student loan enrollment program i wanted to contact you regarding the class action lawsuit agains']",student - loan - student loan - got - fake - support - free - just - voicemail - apple,0.7197571476455933,False,66606,51972,2019-12-06 09:39:52
quickbooks support pro adviser scammer they are fraud one of my friend 999 99 to fix of quickbooks payroll website,-1,-1_student_loan_student loan_got,"['student', 'loan', 'student loan', 'got', 'fake', 'support', 'free', 'just', 'voicemail', 'apple']","['student loan scam so i got a voicemail from sarah the message is as follows hi my name is sarah i ve been trying to reach you regarding your federal student loans your loan has been flagged for forgiveness approval which could eli', 'student loan scam just got a voicemail from julie with student loan enrollment program the message is as follows hi i m julie with the student loan enrollment program i wanted to contact you regarding the class action lawsuit agains', 'student loan scam just got a voicemail from julie with student loan enrollment program the message is as follows hi i m julie with the student loan enrollment program i wanted to contact you regarding the class action lawsuit agains']",student - loan - student loan - got - fake - support - free - just - voicemail - apple,0.719449550369842,False,66607,51971,2019-12-06 09:30:41
garmin scammer another garmin scam site i think it has toll free number,-1,-1_student_loan_student loan_got,"['student', 'loan', 'student loan', 'got', 'fake', 'support', 'free', 'just', 'voicemail', 'apple']","['student loan scam so i got a voicemail from sarah the message is as follows hi my name is sarah i ve been trying to reach you regarding your federal student loans your loan has been flagged for forgiveness approval which could eli', 'student loan scam just got a voicemail from julie with student loan enrollment program the message is as follows hi i m julie with the student loan enrollment program i wanted to contact you regarding the class action lawsuit agains', 'student loan scam just got a voicemail from julie with student loan enrollment program the message is as follows hi i m julie with the student loan enrollment program i wanted to contact you regarding the class action lawsuit agains']",student - loan - student loan - got - fake - support - free - just - voicemail - apple,0.6497564211465651,False,66608,51970,2019-12-06 09:12:29
quickbooks scammer they are scamming quickbooks customer website is,-1,-1_student_loan_student loan_got,"['student', 'loan', 'student loan', 'got', 'fake', 'support', 'free', 'just', 'voicemail', 'apple']","['student loan scam so i got a voicemail from sarah the message is as follows hi my name is sarah i ve been trying to reach you regarding your federal student loans your loan has been flagged for forgiveness approval which could eli', 'student loan scam just got a voicemail from julie with student loan enrollment program the message is as follows hi i m julie with the student loan enrollment program i wanted to contact you regarding the class action lawsuit agains', 'student loan scam just got a voicemail from julie with student loan enrollment program the message is as follows hi i m julie with the student loan enrollment program i wanted to contact you regarding the class action lawsuit agains']",student - loan - student loan - got - fake - support - free - just - voicemail - apple,0.7222007386630457,False,66609,51969,2019-12-06 08:52:08
local rifle website claims selling rifle he asks for me to send the money directly to his paypal def a scam two phone numbers will not send a picture w a number or anything to prove he has it,-1,-1_student_loan_student loan_got,"['student', 'loan', 'student loan', 'got', 'fake', 'support', 'free', 'just', 'voicemail', 'apple']","['student loan scam so i got a voicemail from sarah the message is as follows hi my name is sarah i ve been trying to reach you regarding your federal student loans your loan has been flagged for forgiveness approval which could eli', 'student loan scam just got a voicemail from julie with student loan enrollment program the message is as follows hi i m julie with the student loan enrollment program i wanted to contact you regarding the class action lawsuit agains', 'student loan scam just got a voicemail from julie with student loan enrollment program the message is as follows hi i m julie with the student loan enrollment program i wanted to contact you regarding the class action lawsuit agains']",student - loan - student loan - got - fake - support - free - just - voicemail - apple,0.03764451950005809,False,66610,51966,2019-12-06 07:41:51
rapid dail with auto mouse click software i find software auto mouse click to be the best i tried when it needed to press a number to get to the scammer also using several tabs with the same number it will move from tab to tab and press the number it very,11,11_size_adaross_size adaross_adaross replying,"['size', 'adaross', 'size adaross', 'adaross replying', 'finds', 'automatically automated finds', 'automated finds popups', 'automated finds', 'adaross site list', 'automatically automated']","['adaross scam site list 12 03 2019 size 15 messages here will be posted automatically as the automated system finds popups size b size 12 please do not adaross when replying size b', 'adaross scam site list 12 02 2019 size 15 messages here will be posted automatically as the automated system finds popups size b size 12 please do not adaross when replying size b', 'adaross scam site list 12 06 2019 size 15 messages here will be posted automatically as the automated system finds popups size b size 12 please do not adaross when replying size b']",size - adaross - size adaross - adaross replying - finds - automatically automated finds - automated finds popups - automated finds - adaross site list - automatically automated,1.0,False,66611,51965,2019-12-06 07:24:49
microsoft refund scam called today claiming to be microsoft something that was going out of business so call get any fees you paid refunded so i called knowing it was a scam because the real microsoft doesn t cold call a,1,1_refund_fake refund_refund refund_microsoft refund,"['refund', 'fake refund', 'refund refund', 'microsoft refund', 'department', 'fake', 'voicemail', 'called', 'account', 'support']","['more refund scammers', 'refund scam', 'refund scam']",refund - fake refund - refund refund - microsoft refund - department - fake - voicemail - called - account - support,0.4346198320730277,False,66612,51964,2019-12-06 04:57:27
this website is getting flooded ddos lmao scammer info nice clouldflare ddos protection weak enjoy getting flooded,-1,-1_student_loan_student loan_got,"['student', 'loan', 'student loan', 'got', 'fake', 'support', 'free', 'just', 'voicemail', 'apple']","['student loan scam so i got a voicemail from sarah the message is as follows hi my name is sarah i ve been trying to reach you regarding your federal student loans your loan has been flagged for forgiveness approval which could eli', 'student loan scam just got a voicemail from julie with student loan enrollment program the message is as follows hi i m julie with the student loan enrollment program i wanted to contact you regarding the class action lawsuit agains', 'student loan scam just got a voicemail from julie with student loan enrollment program the message is as follows hi i m julie with the student loan enrollment program i wanted to contact you regarding the class action lawsuit agains']",student - loan - student loan - got - fake - support - free - just - voicemail - apple,0.38534979474498043,False,66613,51963,2019-12-06 00:29:27
grasshopper group gone haven t seen the grassholes for over a month oct 25 by my count also scammers are gravitating toward twilio and vonage twilio shuts them down fast bandwidth com wireless sybase still active but self destructs,12,12_amazon_amazonprime_account_travel,"['amazon', 'amazonprime', 'account', 'travel', 'amazon account', 'robocaller', 'robocaller warning nomorobo', 'robocaller warning', 'warning nomorobo', 'won']","['amazon_prime fake robocall robocaller warning nomorobo from amazon to inform you that your amazon_prime account will be auto renewed for 249 00 from your bank account so enjoy using it as an acco', 'amazon purchase fake amazon purchase 99 robocaller warning nomorobo pay attention this is amazon_prime your amazon_prime it seems your amazon account misused somebody using your amazon account su', 'amazaon charge scam robocaller warning nomorobo call from amazon to inform you that your amazon_prime account will be auto renewed for 249 00 from your bank account so enjoy using it as an account or if y']",amazon - amazonprime - account - travel - amazon account - robocaller - robocaller warning nomorobo - robocaller warning - warning nomorobo - won,1.0,False,66614,51962,2019-12-06 00:08:15
another firewall protection scam,-1,-1_student_loan_student loan_got,"['student', 'loan', 'student loan', 'got', 'fake', 'support', 'free', 'just', 'voicemail', 'apple']","['student loan scam so i got a voicemail from sarah the message is as follows hi my name is sarah i ve been trying to reach you regarding your federal student loans your loan has been flagged for forgiveness approval which could eli', 'student loan scam just got a voicemail from julie with student loan enrollment program the message is as follows hi i m julie with the student loan enrollment program i wanted to contact you regarding the class action lawsuit agains', 'student loan scam just got a voicemail from julie with student loan enrollment program the message is as follows hi i m julie with the student loan enrollment program i wanted to contact you regarding the class action lawsuit agains']",student - loan - student loan - got - fake - support - free - just - voicemail - apple,0.6293880429791392,False,66615,51961,2019-12-05 23:21:57
garmin scammer they asking 499 99 for my map update because my network security was down please feed them with calls,-1,-1_student_loan_student loan_got,"['student', 'loan', 'student loan', 'got', 'fake', 'support', 'free', 'just', 'voicemail', 'apple']","['student loan scam so i got a voicemail from sarah the message is as follows hi my name is sarah i ve been trying to reach you regarding your federal student loans your loan has been flagged for forgiveness approval which could eli', 'student loan scam just got a voicemail from julie with student loan enrollment program the message is as follows hi i m julie with the student loan enrollment program i wanted to contact you regarding the class action lawsuit agains', 'student loan scam just got a voicemail from julie with student loan enrollment program the message is as follows hi i m julie with the student loan enrollment program i wanted to contact you regarding the class action lawsuit agains']",student - loan - student loan - got - fake - support - free - just - voicemail - apple,0.6365094763734087,False,66616,51960,2019-12-05 22:55:30
fake microsoft popup link,4,4_fake microsoft_fake microsoft pop_microsoft pop_pop,"['fake microsoft', 'fake microsoft pop', 'microsoft pop', 'pop', 'fake', 'microsoft', 'pop fake', 'microsoft pop fake', 'pop fake microsoft', 'pop url']","['fake microsoft pop up url fake microsoft pop up', 'fake microsoft pop up url fake microsoft pop up', 'fake microsoft pop up url fake microsoft pop up']",fake microsoft - fake microsoft pop - microsoft pop - pop - fake - microsoft - pop fake - microsoft pop fake - pop fake microsoft - pop url,0.3176442048511903,False,66617,51959,2019-12-05 22:38:06
ssa scam indian scammer fake david collins,2,2_ssa_ssa ssa_indian_fake,"['ssa', 'ssa ssa', 'indian', 'fake', 'ms', 'ssa indian', 'ssa ssa ssa', 'indian fake', 'dea', 'fake ssa']","['ssa scam', 'ssa scam 12 18 19', 'ssa scam a ssa scam']",ssa - ssa ssa - indian - fake - ms - ssa indian - ssa ssa ssa - indian fake - dea - fake ssa,0.3557889647360799,False,66618,51958,2019-12-05 22:25:17
another one have fun call these people they keep calling me but there block but yes there are scammers here s the number,5,5_money_bank_power_company,"['money', 'bank', 'power', 'company', 'scammed', 'apartment', 'guy', 'spoofed', 'yes', 'sent']","['one more bank acc info used by scammers in intense 419 scam here you go one more bank acc this scammer is quite optimistic in getting his money use this informztion how ever you like scum deserves hell and no less bank name barclays bank plc bank address acorn hous', 'coned unpaid balance power shutoff threat scam robo dialed from spoofed number claims to be coned and your power will be turned off in 30 minutes unless you call the scammers number and presumably give them money these evil jerks needs to be pounded the num', 'pg e unpaid balance power shutoff threat scam robodialed from spoofed number claims to be pg e and your power will be turned off in 30 minutes unless you call the scammers number and presumably give them money evil scammer needs to be pounded the number le']",money - bank - power - company - scammed - apartment - guy - spoofed - yes - sent,1.0,False,66619,51957,2019-12-05 22:15:47
microsoft popup scam link appears to be a working number of an indian tech_support call center,3,3_microsoft popup_popup_appears working_appears,"['microsoft popup', 'popup', 'appears working', 'appears', 'techsupport center', 'working indian', 'indian techsupport center', 'working indian techsupport', 'appears working indian', 'indian techsupport']","['microsoft popup scam link appears to be a working number of an indian tech_support call center', 'microsoft popup scam link appears to be a working number of an indian tech_support call center microsoft popup scam', 'microsoft popup scam link appears to be a working number of an indian tech_support call center']",microsoft popup - popup - appears working - appears - techsupport center - working indian - indian techsupport center - working indian techsupport - appears working indian - indian techsupport,0.8008159814467586,True,66620,51955,2019-12-05 21:55:09
had a conversation with mike he told said he s been scamming for 3 months he said only 10 of calls are scambaiters we have to increase this i asked him if he wanted his mother or grandmother to be scammed and he,-1,-1_student_loan_student loan_got,"['student', 'loan', 'student loan', 'got', 'fake', 'support', 'free', 'just', 'voicemail', 'apple']","['student loan scam so i got a voicemail from sarah the message is as follows hi my name is sarah i ve been trying to reach you regarding your federal student loans your loan has been flagged for forgiveness approval which could eli', 'student loan scam just got a voicemail from julie with student loan enrollment program the message is as follows hi i m julie with the student loan enrollment program i wanted to contact you regarding the class action lawsuit agains', 'student loan scam just got a voicemail from julie with student loan enrollment program the message is as follows hi i m julie with the student loan enrollment program i wanted to contact you regarding the class action lawsuit agains']",student - loan - student loan - got - fake - support - free - just - voicemail - apple,0.4952843814256659,False,66621,51954,2019-12-05 21:47:30
ssa scam got a call saying my ssn had fraudulent activity and was then asked to say my name dob and ssn to verify the fraudulent activity was on my account,0,0_social_social security_security_administration,"['social', 'social security', 'security', 'administration', 'security administration', 'social security administration', 'phone', 'ssa', 'alert nomorobo', 'phone alert']","['ssa scam phone scam alert nomorobo hi this message is intended for you from the social security administration we have received a legal complaint under your social security number and your drive', 'ssa scam phone scam alert nomorobo hi this message is intended for you from social security administration we have received a legal complaint under your social security number and your driver s', 'ssa scam phone scam alert nomorobo hi this message is intended for you from social security administration we have received a legal complaint under your social security number and your driver s']",social - social security - security - administration - security administration - social security administration - phone - ssa - alert nomorobo - phone alert,0.772037698094389,False,66622,51953,2019-12-05 21:43:06
