Document,Topic,Name,Representation,Representative_Docs,Top_n_words,Probability,Representative_document,orig_index,id,created_at
social security scam just got this one about and hour ago the number is said they are from social security office,0,0_social_social security_security_administration,"['social', 'social security', 'security', 'administration', 'security administration', 'social security administration', 'phone', 'ssa', 'alert nomorobo', 'phone alert']","['ssa scam phone scam alert nomorobo hi this message is intended for you from the social security administration we have received a legal complaint under your social security number and your drive', 'ssa scam phone scam alert nomorobo hi this message is intended for you from social security administration we have received a legal complaint under your social security number and your driver s', 'ssa scam phone scam alert nomorobo hi this message is intended for you from social security administration we have received a legal complaint under your social security number and your driver s']",social - social security - security - administration - security administration - social security administration - phone - ssa - alert nomorobo - phone alert,1.0,False,66086,52519,2019-12-19 18:45:21
ssa scam very filthy mouth indian scammers,2,2_ssa_ssa ssa_indian_fake,"['ssa', 'ssa ssa', 'indian', 'fake', 'ms', 'ssa indian', 'ssa ssa ssa', 'indian fake', 'dea', 'fake ssa']","['ssa scam', 'ssa scam 12 18 19', 'ssa scam a ssa scam']",ssa - ssa ssa - indian - fake - ms - ssa indian - ssa ssa ssa - indian fake - dea - fake ssa,0.41545200218964295,False,66087,52518,2019-12-19 18:11:37
ssa scam phone scam alert nomorobo hi this message is intended for you from social security administration we have received a legal complaint under your social security number and your driver li,0,0_social_social security_security_administration,"['social', 'social security', 'security', 'administration', 'security administration', 'social security administration', 'phone', 'ssa', 'alert nomorobo', 'phone alert']","['ssa scam phone scam alert nomorobo hi this message is intended for you from the social security administration we have received a legal complaint under your social security number and your drive', 'ssa scam phone scam alert nomorobo hi this message is intended for you from social security administration we have received a legal complaint under your social security number and your driver s', 'ssa scam phone scam alert nomorobo hi this message is intended for you from social security administration we have received a legal complaint under your social security number and your driver s']",social - social security - security - administration - security administration - social security administration - phone - ssa - alert nomorobo - phone alert,0.15504573990828424,False,66088,52517,2019-12-19 16:46:31
ssa scam skype l3 ssa scam on skype typical foul mouths happy hunting note if the bob link does not connect try an alternate method such as textnow number will be down today,-1,-1_student_loan_student loan_got,"['student', 'loan', 'student loan', 'got', 'fake', 'support', 'free', 'just', 'voicemail', 'apple']","['student loan scam so i got a voicemail from sarah the message is as follows hi my name is sarah i ve been trying to reach you regarding your federal student loans your loan has been flagged for forgiveness approval which could eli', 'student loan scam just got a voicemail from julie with student loan enrollment program the message is as follows hi i m julie with the student loan enrollment program i wanted to contact you regarding the class action lawsuit agains', 'student loan scam just got a voicemail from julie with student loan enrollment program the message is as follows hi i m julie with the student loan enrollment program i wanted to contact you regarding the class action lawsuit agains']",student - loan - student loan - got - fake - support - free - just - voicemail - apple,0.6153665815259839,False,66089,52516,2019-12-19 16:39:43
ssa scam received robocall this morning from fake ssa,2,2_ssa_ssa ssa_indian_fake,"['ssa', 'ssa ssa', 'indian', 'fake', 'ms', 'ssa indian', 'ssa ssa ssa', 'indian fake', 'dea', 'fake ssa']","['ssa scam', 'ssa scam 12 18 19', 'ssa scam a ssa scam']",ssa - ssa ssa - indian - fake - ms - ssa indian - ssa ssa ssa - indian fake - dea - fake ssa,0.5295864455026236,False,66090,52515,2019-12-19 16:29:45
ssn scammers,2,2_ssa_ssa ssa_indian_fake,"['ssa', 'ssa ssa', 'indian', 'fake', 'ms', 'ssa indian', 'ssa ssa ssa', 'indian fake', 'dea', 'fake ssa']","['ssa scam', 'ssa scam 12 18 19', 'ssa scam a ssa scam']",ssa - ssa ssa - indian - fake - ms - ssa indian - ssa ssa ssa - indian fake - dea - fake ssa,0.24897740565198773,False,66091,52514,2019-12-19 16:05:26
ssa scam i am not sure if you guys know about this number yet it is a social security number scam which left their message on my phone stating the usual about them investigating my social security number for fraud and to call,0,0_social_social security_security_administration,"['social', 'social security', 'security', 'administration', 'security administration', 'social security administration', 'phone', 'ssa', 'alert nomorobo', 'phone alert']","['ssa scam phone scam alert nomorobo hi this message is intended for you from the social security administration we have received a legal complaint under your social security number and your drive', 'ssa scam phone scam alert nomorobo hi this message is intended for you from social security administration we have received a legal complaint under your social security number and your driver s', 'ssa scam phone scam alert nomorobo hi this message is intended for you from social security administration we have received a legal complaint under your social security number and your driver s']",social - social security - security - administration - security administration - social security administration - phone - ssa - alert nomorobo - phone alert,1.0,False,66092,52513,2019-12-19 15:51:01
crazybulk scam crazy bulk claims to sell legal alternatives to steroids despite having no evidence to support their claims of their product actually working they are not fda approved or approved by any health agency they dont say wh,8,8_insurance_health_warranty_car,"['insurance', 'health', 'warranty', 'car', 'company', 'pills', 'health insurance', 'sell', 'keto', 'gohealth']","['high value insurance scam three automated messages from an issam hiring manager at family first life saying he got my application for a high value insurance policy on craigslist has been calling my desk phone at work and i don t use craigsli', 'health insurance scam', 'this is a shady car insurance company called protect my car offering free roadside assistance and 100 car maintenance coverage and insurance for 50 bucks a month plus a flexible down payment fee wh']",insurance - health - warranty - car - company - pills - health insurance - sell - keto - gohealth,1.0,False,66093,52512,2019-12-19 14:09:40
credit card expiration scam hello scambaiters this is my first post here and hopefully it s decent i got a call from these two tards and they re telling me that i can have my credit card balances lowered by pressing 1 i don t even have a cre,5,5_money_bank_power_company,"['money', 'bank', 'power', 'company', 'scammed', 'apartment', 'guy', 'spoofed', 'yes', 'sent']","['one more bank acc info used by scammers in intense 419 scam here you go one more bank acc this scammer is quite optimistic in getting his money use this informztion how ever you like scum deserves hell and no less bank name barclays bank plc bank address acorn hous', 'coned unpaid balance power shutoff threat scam robo dialed from spoofed number claims to be coned and your power will be turned off in 30 minutes unless you call the scammers number and presumably give them money these evil jerks needs to be pounded the num', 'pg e unpaid balance power shutoff threat scam robodialed from spoofed number claims to be pg e and your power will be turned off in 30 minutes unless you call the scammers number and presumably give them money evil scammer needs to be pounded the number le']",money - bank - power - company - scammed - apartment - guy - spoofed - yes - sent,0.2968161210433793,False,66094,52511,2019-12-19 13:42:57
bobrtc in call sounds now available we have some single play sounds you can queue up in a bobrtc call to play them use the pound key on the dtmf pad during your call code 0 bullshit sgt hartman 1 double kill halo 2 error windows xp 3,7,7_bobrtc_bob_calls_add,"['bobrtc', 'bob', 'calls', 'add', 'non', 'phonebook', 'work', 'available', 'uk', 'connect']","['bobrtc question i opened bobrtc today and i were no longer able to add numbers i ve got 39322xp now my question how long does an account need to exist to add numbers it s a bit sad that there are not so much numbers on bobrtc bu', 'bobrtc is moving to a new site this weekend dec 21 bobrtc tel bobrtc has thwarted yet another takedown attempt this time an attacker went after godaddy the registrar of bobrtc live by sending bupkis complaints a few months ago a lawyer was haggling godaddy trying to pry owner', 'limited non toll free dialing available again on bobrtc we have some non toll free dialing available again on bobrtc this outage was due to losing an agreement to deliver traffic the previous outage of ntf 4 weeks ago had everything to do with what numbers were being di']",bobrtc - bob - calls - add - non - phonebook - work - available - uk - connect,0.6915697759112683,False,66095,52510,2019-12-19 06:53:05
adaross scam site list 12 19 2019 size 15 messages here will be posted automatically as the automated system finds popups size b size 12 please do not adaross when replying size b,11,11_size_adaross_size adaross_adaross replying,"['size', 'adaross', 'size adaross', 'adaross replying', 'finds', 'automatically automated finds', 'automated finds popups', 'automated finds', 'adaross site list', 'automatically automated']","['adaross scam site list 12 03 2019 size 15 messages here will be posted automatically as the automated system finds popups size b size 12 please do not adaross when replying size b', 'adaross scam site list 12 02 2019 size 15 messages here will be posted automatically as the automated system finds popups size b size 12 please do not adaross when replying size b', 'adaross scam site list 12 06 2019 size 15 messages here will be posted automatically as the automated system finds popups size b size 12 please do not adaross when replying size b']",size - adaross - size adaross - adaross replying - finds - automatically automated finds - automated finds popups - automated finds - adaross site list - automatically automated,1.0,False,66096,52509,2019-12-19 06:00:47
online pharmacy pills scam,8,8_insurance_health_warranty_car,"['insurance', 'health', 'warranty', 'car', 'company', 'pills', 'health insurance', 'sell', 'keto', 'gohealth']","['high value insurance scam three automated messages from an issam hiring manager at family first life saying he got my application for a high value insurance policy on craigslist has been calling my desk phone at work and i don t use craigsli', 'health insurance scam', 'this is a shady car insurance company called protect my car offering free roadside assistance and 100 car maintenance coverage and insurance for 50 bucks a month plus a flexible down payment fee wh']",insurance - health - warranty - car - company - pills - health insurance - sell - keto - gohealth,1.0,False,66097,52508,2019-12-19 00:52:40
social security suspension scam is a social security scammer that called me earlier i m new here so let me know if i need to add or remove anything,0,0_social_social security_security_administration,"['social', 'social security', 'security', 'administration', 'security administration', 'social security administration', 'phone', 'ssa', 'alert nomorobo', 'phone alert']","['ssa scam phone scam alert nomorobo hi this message is intended for you from the social security administration we have received a legal complaint under your social security number and your drive', 'ssa scam phone scam alert nomorobo hi this message is intended for you from social security administration we have received a legal complaint under your social security number and your driver s', 'ssa scam phone scam alert nomorobo hi this message is intended for you from social security administration we have received a legal complaint under your social security number and your driver s']",social - social security - security - administration - security administration - social security administration - phone - ssa - alert nomorobo - phone alert,0.4194764419924702,False,66098,52507,2019-12-18 23:27:52
ssa scam 12 18 19,2,2_ssa_ssa ssa_indian_fake,"['ssa', 'ssa ssa', 'indian', 'fake', 'ms', 'ssa indian', 'ssa ssa ssa', 'indian fake', 'dea', 'fake ssa']","['ssa scam', 'ssa scam 12 18 19', 'ssa scam a ssa scam']",ssa - ssa ssa - indian - fake - ms - ssa indian - ssa ssa ssa - indian fake - dea - fake ssa,1.0,True,66099,52506,2019-12-18 22:12:12
scam call center 12 18 19 toll free numbers call back number some of the number sb98 and the last one take me to a state farm number i was like wtf xxxx,5,5_money_bank_power_company,"['money', 'bank', 'power', 'company', 'scammed', 'apartment', 'guy', 'spoofed', 'yes', 'sent']","['one more bank acc info used by scammers in intense 419 scam here you go one more bank acc this scammer is quite optimistic in getting his money use this informztion how ever you like scum deserves hell and no less bank name barclays bank plc bank address acorn hous', 'coned unpaid balance power shutoff threat scam robo dialed from spoofed number claims to be coned and your power will be turned off in 30 minutes unless you call the scammers number and presumably give them money these evil jerks needs to be pounded the num', 'pg e unpaid balance power shutoff threat scam robodialed from spoofed number claims to be pg e and your power will be turned off in 30 minutes unless you call the scammers number and presumably give them money evil scammer needs to be pounded the number le']",money - bank - power - company - scammed - apartment - guy - spoofed - yes - sent,0.41100163816398577,False,66100,52505,2019-12-18 22:05:37
microsoft popup scam url fake microsoft popup appears to be a working number of an indian tech_support call center,3,3_microsoft popup_popup_appears working_appears,"['microsoft popup', 'popup', 'appears working', 'appears', 'techsupport center', 'working indian', 'indian techsupport center', 'working indian techsupport', 'appears working indian', 'indian techsupport']","['microsoft popup scam link appears to be a working number of an indian tech_support call center', 'microsoft popup scam link appears to be a working number of an indian tech_support call center microsoft popup scam', 'microsoft popup scam link appears to be a working number of an indian tech_support call center']",microsoft popup - popup - appears working - appears - techsupport center - working indian - indian techsupport center - working indian techsupport - appears working indian - indian techsupport,1.0,False,66101,52504,2019-12-18 21:56:42
fake microsoft pop up url fake microsoft pop up,4,4_fake microsoft_fake microsoft pop_microsoft pop_pop,"['fake microsoft', 'fake microsoft pop', 'microsoft pop', 'pop', 'fake', 'microsoft', 'pop fake', 'microsoft pop fake', 'pop fake microsoft', 'pop url']","['fake microsoft pop up url fake microsoft pop up', 'fake microsoft pop up url fake microsoft pop up', 'fake microsoft pop up url fake microsoft pop up']",fake microsoft - fake microsoft pop - microsoft pop - pop - fake - microsoft - pop fake - microsoft pop fake - pop fake microsoft - pop url,0.29794735648034054,True,66102,52503,2019-12-18 21:27:18
student loan forgiveness scammer this guy tried to get my full social security number and my login for my student loan account after i accused him of being a scammer he said he could erase all my student loan debt for 200 please flood his line he,-1,-1_student_loan_student loan_got,"['student', 'loan', 'student loan', 'got', 'fake', 'support', 'free', 'just', 'voicemail', 'apple']","['student loan scam so i got a voicemail from sarah the message is as follows hi my name is sarah i ve been trying to reach you regarding your federal student loans your loan has been flagged for forgiveness approval which could eli', 'student loan scam just got a voicemail from julie with student loan enrollment program the message is as follows hi i m julie with the student loan enrollment program i wanted to contact you regarding the class action lawsuit agains', 'student loan scam just got a voicemail from julie with student loan enrollment program the message is as follows hi i m julie with the student loan enrollment program i wanted to contact you regarding the class action lawsuit agains']",student - loan - student loan - got - fake - support - free - just - voicemail - apple,0.7286295999044234,False,66103,52502,2019-12-18 21:07:21
fake microsoft pop up url fake microsoft pop up,4,4_fake microsoft_fake microsoft pop_microsoft pop_pop,"['fake microsoft', 'fake microsoft pop', 'microsoft pop', 'pop', 'fake', 'microsoft', 'pop fake', 'microsoft pop fake', 'pop fake microsoft', 'pop url']","['fake microsoft pop up url fake microsoft pop up', 'fake microsoft pop up url fake microsoft pop up', 'fake microsoft pop up url fake microsoft pop up']",fake microsoft - fake microsoft pop - microsoft pop - pop - fake - microsoft - pop fake - microsoft pop fake - pop fake microsoft - pop url,0.2937695594798274,True,66104,52501,2019-12-18 20:55:50
microsoft popup scam url fake microsoft popup appears to be a working number of an indian tech_support call center,3,3_microsoft popup_popup_appears working_appears,"['microsoft popup', 'popup', 'appears working', 'appears', 'techsupport center', 'working indian', 'indian techsupport center', 'working indian techsupport', 'appears working indian', 'indian techsupport']","['microsoft popup scam link appears to be a working number of an indian tech_support call center', 'microsoft popup scam link appears to be a working number of an indian tech_support call center microsoft popup scam', 'microsoft popup scam link appears to be a working number of an indian tech_support call center']",microsoft popup - popup - appears working - appears - techsupport center - working indian - indian techsupport center - working indian techsupport - appears working indian - indian techsupport,1.0,False,66105,52500,2019-12-18 20:55:32
ecommerce scam ind aus rom uk usa canada get in touch with us fitser,-1,-1_student_loan_student loan_got,"['student', 'loan', 'student loan', 'got', 'fake', 'support', 'free', 'just', 'voicemail', 'apple']","['student loan scam so i got a voicemail from sarah the message is as follows hi my name is sarah i ve been trying to reach you regarding your federal student loans your loan has been flagged for forgiveness approval which could eli', 'student loan scam just got a voicemail from julie with student loan enrollment program the message is as follows hi i m julie with the student loan enrollment program i wanted to contact you regarding the class action lawsuit agains', 'student loan scam just got a voicemail from julie with student loan enrollment program the message is as follows hi i m julie with the student loan enrollment program i wanted to contact you regarding the class action lawsuit agains']",student - loan - student loan - got - fake - support - free - just - voicemail - apple,0.4015959682836767,False,66106,52499,2019-12-18 20:49:36
refund scam spent 3 5 hours with one of the refund scams i posted yesterday and got a bunch of their other numbers main number other numbers,1,1_refund_fake refund_refund refund_microsoft refund,"['refund', 'fake refund', 'refund refund', 'microsoft refund', 'department', 'fake', 'voicemail', 'called', 'account', 'support']","['more refund scammers', 'refund scam', 'refund scam']",refund - fake refund - refund refund - microsoft refund - department - fake - voicemail - called - account - support,1.0,False,66107,52498,2019-12-18 20:46:56
cashier banking scam this number is his number he runs a cashier scam trying to scam people into sending him money his name is trevor he scammed my brother and accessed his bank account almost stole 5 000,5,5_money_bank_power_company,"['money', 'bank', 'power', 'company', 'scammed', 'apartment', 'guy', 'spoofed', 'yes', 'sent']","['one more bank acc info used by scammers in intense 419 scam here you go one more bank acc this scammer is quite optimistic in getting his money use this informztion how ever you like scum deserves hell and no less bank name barclays bank plc bank address acorn hous', 'coned unpaid balance power shutoff threat scam robo dialed from spoofed number claims to be coned and your power will be turned off in 30 minutes unless you call the scammers number and presumably give them money these evil jerks needs to be pounded the num', 'pg e unpaid balance power shutoff threat scam robodialed from spoofed number claims to be pg e and your power will be turned off in 30 minutes unless you call the scammers number and presumably give them money evil scammer needs to be pounded the number le']",money - bank - power - company - scammed - apartment - guy - spoofed - yes - sent,1.0,False,66108,52497,2019-12-18 20:42:12
refund scam yes more refund scammers,1,1_refund_fake refund_refund refund_microsoft refund,"['refund', 'fake refund', 'refund refund', 'microsoft refund', 'department', 'fake', 'voicemail', 'called', 'account', 'support']","['more refund scammers', 'refund scam', 'refund scam']",refund - fake refund - refund refund - microsoft refund - department - fake - voicemail - called - account - support,1.0,False,66109,52496,2019-12-18 20:38:16
pop up scammer running pop up scam,10,10_popup_image_popup microsoft_microsoft popup microsoft,"['popup', 'image', 'popup microsoft', 'microsoft popup microsoft', 'png', 'popup microsoft popup', 'microsoft', 'microsoft popup', 'screenshot', 'image screenshot']","['microsoft popup scam link', 'dating app chat image screenshot 135517png png image screenshot 135526png png', 'romance scammer jean image screenshot 115148png png image screenshot 115156png png']",popup - image - popup microsoft - microsoft popup microsoft - png - popup microsoft popup - microsoft - microsoft popup - screenshot - image screenshot,1.0,False,66110,52495,2019-12-18 20:29:49
microsoft scammer fake microsoft support,9,9_microsoft_windows_microsoft support_support,"['microsoft', 'windows', 'microsoft support', 'support', 'computer', 'pc', 'microsoft techsupport', 'vm', 'tried', 'techsupport']","['microsoft tech_support scam 12 20 19', 'microsoft scammer fake microsoft support', 'microsoft support scam']",microsoft - windows - microsoft support - support - computer - pc - microsoft techsupport - vm - tried - techsupport,1.0,True,66111,52494,2019-12-18 20:28:06
microsoft popup scam url fake microsoft popup appears to be a working number of an indian tech_support call center,3,3_microsoft popup_popup_appears working_appears,"['microsoft popup', 'popup', 'appears working', 'appears', 'techsupport center', 'working indian', 'indian techsupport center', 'working indian techsupport', 'appears working indian', 'indian techsupport']","['microsoft popup scam link appears to be a working number of an indian tech_support call center', 'microsoft popup scam link appears to be a working number of an indian tech_support call center microsoft popup scam', 'microsoft popup scam link appears to be a working number of an indian tech_support call center']",microsoft popup - popup - appears working - appears - techsupport center - working indian - indian techsupport center - working indian techsupport - appears working indian - indian techsupport,0.5828190267286592,False,66112,52493,2019-12-18 20:20:50
fake microsoft pop up url fake microsoft pop up,4,4_fake microsoft_fake microsoft pop_microsoft pop_pop,"['fake microsoft', 'fake microsoft pop', 'microsoft pop', 'pop', 'fake', 'microsoft', 'pop fake', 'microsoft pop fake', 'pop fake microsoft', 'pop url']","['fake microsoft pop up url fake microsoft pop up', 'fake microsoft pop up url fake microsoft pop up', 'fake microsoft pop up url fake microsoft pop up']",fake microsoft - fake microsoft pop - microsoft pop - pop - fake - microsoft - pop fake - microsoft pop fake - pop fake microsoft - pop url,0.29607654810763245,True,66113,52492,2019-12-18 20:16:57
microsoft popup scam url fake microsoft popup appears to be a working number of an indian tech_support call center,3,3_microsoft popup_popup_appears working_appears,"['microsoft popup', 'popup', 'appears working', 'appears', 'techsupport center', 'working indian', 'indian techsupport center', 'working indian techsupport', 'appears working indian', 'indian techsupport']","['microsoft popup scam link appears to be a working number of an indian tech_support call center', 'microsoft popup scam link appears to be a working number of an indian tech_support call center microsoft popup scam', 'microsoft popup scam link appears to be a working number of an indian tech_support call center']",microsoft popup - popup - appears working - appears - techsupport center - working indian - indian techsupport center - working indian techsupport - appears working indian - indian techsupport,1.0,False,66114,52491,2019-12-18 20:07:59
