Document,Topic,Name,Representation,Representative_Docs,Top_n_words,Probability,Representative_document,orig_index,id,created_at
scammerd they have send pop up in my computer and have charged 6000 there information address 1099 westheimer rd houston tx 77056 united states toll free no webiste allnetsolution com email s,5,5_money_bank_power_company,"['money', 'bank', 'power', 'company', 'scammed', 'apartment', 'guy', 'spoofed', 'yes', 'sent']","['one more bank acc info used by scammers in intense 419 scam here you go one more bank acc this scammer is quite optimistic in getting his money use this informztion how ever you like scum deserves hell and no less bank name barclays bank plc bank address acorn hous', 'coned unpaid balance power shutoff threat scam robo dialed from spoofed number claims to be coned and your power will be turned off in 30 minutes unless you call the scammers number and presumably give them money these evil jerks needs to be pounded the num', 'pg e unpaid balance power shutoff threat scam robodialed from spoofed number claims to be pg e and your power will be turned off in 30 minutes unless you call the scammers number and presumably give them money evil scammer needs to be pounded the number le']",money - bank - power - company - scammed - apartment - guy - spoofed - yes - sent,1.0,False,66350,52244,2019-12-13 00:45:03
scammers sending pop up to our computers address 1099 westheimer rd houston tx 77056 united states toll free no email office time 09 00 am to 09 00 pm est,-1,-1_student_loan_student loan_got,"['student', 'loan', 'student loan', 'got', 'fake', 'support', 'free', 'just', 'voicemail', 'apple']","['student loan scam so i got a voicemail from sarah the message is as follows hi my name is sarah i ve been trying to reach you regarding your federal student loans your loan has been flagged for forgiveness approval which could eli', 'student loan scam just got a voicemail from julie with student loan enrollment program the message is as follows hi i m julie with the student loan enrollment program i wanted to contact you regarding the class action lawsuit agains', 'student loan scam just got a voicemail from julie with student loan enrollment program the message is as follows hi i m julie with the student loan enrollment program i wanted to contact you regarding the class action lawsuit agains']",student - loan - student loan - got - fake - support - free - just - voicemail - apple,0.3916463898790574,False,66351,52243,2019-12-13 00:40:44
la pura anti aging cream scam la pura sells questionable anti aging cream straight up scamming people their amazon page,8,8_insurance_health_warranty_car,"['insurance', 'health', 'warranty', 'car', 'company', 'pills', 'health insurance', 'sell', 'keto', 'gohealth']","['high value insurance scam three automated messages from an issam hiring manager at family first life saying he got my application for a high value insurance policy on craigslist has been calling my desk phone at work and i don t use craigsli', 'health insurance scam', 'this is a shady car insurance company called protect my car offering free roadside assistance and 100 car maintenance coverage and insurance for 50 bucks a month plus a flexible down payment fee wh']",insurance - health - warranty - car - company - pills - health insurance - sell - keto - gohealth,1.0,False,66352,52242,2019-12-13 00:02:54
ssa scam phone scam alert nomorobo department of social security administration the reason you have received the phone call from our department is to inform you that there is a law enforcement a,0,0_social_social security_security_administration,"['social', 'social security', 'security', 'administration', 'security administration', 'social security administration', 'phone', 'ssa', 'alert nomorobo', 'phone alert']","['ssa scam phone scam alert nomorobo hi this message is intended for you from the social security administration we have received a legal complaint under your social security number and your drive', 'ssa scam phone scam alert nomorobo hi this message is intended for you from social security administration we have received a legal complaint under your social security number and your driver s', 'ssa scam phone scam alert nomorobo hi this message is intended for you from social security administration we have received a legal complaint under your social security number and your driver s']",social - social security - security - administration - security administration - social security administration - phone - ssa - alert nomorobo - phone alert,0.2801319440805318,False,66353,52241,2019-12-12 23:28:45
google airline disney scam ive received a call by 2 very very happy hindu womens who was sooooo happy i won they were too friendly and kind the first anna 0527 she tells me she s from google and that i have won a trip to disney land and a cruis,12,12_amazon_amazonprime_account_travel,"['amazon', 'amazonprime', 'account', 'travel', 'amazon account', 'robocaller', 'robocaller warning nomorobo', 'robocaller warning', 'warning nomorobo', 'won']","['amazon_prime fake robocall robocaller warning nomorobo from amazon to inform you that your amazon_prime account will be auto renewed for 249 00 from your bank account so enjoy using it as an acco', 'amazon purchase fake amazon purchase 99 robocaller warning nomorobo pay attention this is amazon_prime your amazon_prime it seems your amazon account misused somebody using your amazon account su', 'amazaon charge scam robocaller warning nomorobo call from amazon to inform you that your amazon_prime account will be auto renewed for 249 00 from your bank account so enjoy using it as an account or if y']",amazon - amazonprime - account - travel - amazon account - robocaller - robocaller warning nomorobo - robocaller warning - warning nomorobo - won,1.0,False,66354,52240,2019-12-12 23:22:23
ssa scam ssa indian scammers fake victor frank and austin brown,2,2_ssa_ssa ssa_indian_fake,"['ssa', 'ssa ssa', 'indian', 'fake', 'ms', 'ssa indian', 'ssa ssa ssa', 'indian fake', 'dea', 'fake ssa']","['ssa scam', 'ssa scam 12 18 19', 'ssa scam a ssa scam']",ssa - ssa ssa - indian - fake - ms - ssa indian - ssa ssa ssa - indian fake - dea - fake ssa,0.44810887371886,False,66355,52239,2019-12-12 22:30:49
wrong scammer info link,-1,-1_student_loan_student loan_got,"['student', 'loan', 'student loan', 'got', 'fake', 'support', 'free', 'just', 'voicemail', 'apple']","['student loan scam so i got a voicemail from sarah the message is as follows hi my name is sarah i ve been trying to reach you regarding your federal student loans your loan has been flagged for forgiveness approval which could eli', 'student loan scam just got a voicemail from julie with student loan enrollment program the message is as follows hi i m julie with the student loan enrollment program i wanted to contact you regarding the class action lawsuit agains', 'student loan scam just got a voicemail from julie with student loan enrollment program the message is as follows hi i m julie with the student loan enrollment program i wanted to contact you regarding the class action lawsuit agains']",student - loan - student loan - got - fake - support - free - just - voicemail - apple,0.0282710628066275,False,66356,52238,2019-12-12 21:57:55
fresh american habibi i just received the best buisness offer of my life 10k a month for doing nothing get i m while he s hot bois,-1,-1_student_loan_student loan_got,"['student', 'loan', 'student loan', 'got', 'fake', 'support', 'free', 'just', 'voicemail', 'apple']","['student loan scam so i got a voicemail from sarah the message is as follows hi my name is sarah i ve been trying to reach you regarding your federal student loans your loan has been flagged for forgiveness approval which could eli', 'student loan scam just got a voicemail from julie with student loan enrollment program the message is as follows hi i m julie with the student loan enrollment program i wanted to contact you regarding the class action lawsuit agains', 'student loan scam just got a voicemail from julie with student loan enrollment program the message is as follows hi i m julie with the student loan enrollment program i wanted to contact you regarding the class action lawsuit agains']",student - loan - student loan - got - fake - support - free - just - voicemail - apple,0.3796905483542047,False,66357,52237,2019-12-12 21:38:45
amazon scam amazon scam automated message on initial call states that my amazon account has been charged 999 dollars called back and they are definitely dirty indians hit them hard,12,12_amazon_amazonprime_account_travel,"['amazon', 'amazonprime', 'account', 'travel', 'amazon account', 'robocaller', 'robocaller warning nomorobo', 'robocaller warning', 'warning nomorobo', 'won']","['amazon_prime fake robocall robocaller warning nomorobo from amazon to inform you that your amazon_prime account will be auto renewed for 249 00 from your bank account so enjoy using it as an acco', 'amazon purchase fake amazon purchase 99 robocaller warning nomorobo pay attention this is amazon_prime your amazon_prime it seems your amazon account misused somebody using your amazon account su', 'amazaon charge scam robocaller warning nomorobo call from amazon to inform you that your amazon_prime account will be auto renewed for 249 00 from your bank account so enjoy using it as an account or if y']",amazon - amazonprime - account - travel - amazon account - robocaller - robocaller warning nomorobo - robocaller warning - warning nomorobo - won,1.0,False,66358,52236,2019-12-12 21:26:04
microsoft popup scam link appears to be a working number of an indian tech_support call center,3,3_microsoft popup_popup_appears working_appears,"['microsoft popup', 'popup', 'appears working', 'appears', 'techsupport center', 'working indian', 'indian techsupport center', 'working indian techsupport', 'appears working indian', 'indian techsupport']","['microsoft popup scam link appears to be a working number of an indian tech_support call center', 'microsoft popup scam link appears to be a working number of an indian tech_support call center microsoft popup scam', 'microsoft popup scam link appears to be a working number of an indian tech_support call center']",microsoft popup - popup - appears working - appears - techsupport center - working indian - indian techsupport center - working indian techsupport - appears working indian - indian techsupport,1.0,True,66359,52235,2019-12-12 21:24:11
tech scam nsa phone scam alert nomorobo his call is from national security agency we encounter a serious issue coming out of your computer and devices it seems to be someone is trying to hijack your,-1,-1_student_loan_student loan_got,"['student', 'loan', 'student loan', 'got', 'fake', 'support', 'free', 'just', 'voicemail', 'apple']","['student loan scam so i got a voicemail from sarah the message is as follows hi my name is sarah i ve been trying to reach you regarding your federal student loans your loan has been flagged for forgiveness approval which could eli', 'student loan scam just got a voicemail from julie with student loan enrollment program the message is as follows hi i m julie with the student loan enrollment program i wanted to contact you regarding the class action lawsuit agains', 'student loan scam just got a voicemail from julie with student loan enrollment program the message is as follows hi i m julie with the student loan enrollment program i wanted to contact you regarding the class action lawsuit agains']",student - loan - student loan - got - fake - support - free - just - voicemail - apple,0.47319944163165306,False,66360,52234,2019-12-12 21:05:40
microsoft popup scam link appears to be a working number of an indian tech_support call center,3,3_microsoft popup_popup_appears working_appears,"['microsoft popup', 'popup', 'appears working', 'appears', 'techsupport center', 'working indian', 'indian techsupport center', 'working indian techsupport', 'appears working indian', 'indian techsupport']","['microsoft popup scam link appears to be a working number of an indian tech_support call center', 'microsoft popup scam link appears to be a working number of an indian tech_support call center microsoft popup scam', 'microsoft popup scam link appears to be a working number of an indian tech_support call center']",microsoft popup - popup - appears working - appears - techsupport center - working indian - indian techsupport center - working indian techsupport - appears working indian - indian techsupport,1.0,True,66361,52233,2019-12-12 21:05:05
reservations with glen used to be tech_support,6,6_techsupport_techsupport techsupport_tech_active,"['techsupport', 'techsupport techsupport', 'tech', 'active', 'nginx', 'ha', 'india', 'techsupport techsupport techsupport', 'isoftwareshop', 'indian']","['fake mcafee support scammer from india geek kart com innovative sale vizpc com isoftwareshop com alphasaleweb com thanks my indian friend monis for his help i got these fro', 'heeeey yooooou guuuuuys ah ha ha nginx is often found as the server running that supplies these tech_support scam pages russian media group rambler attempting to hold nginx hostage ars technica i fin', 'heeeey youuuu guuuuys ah ha ha nginx is often found as the server running that supplies these tech_support scam pages russian media group rambler attempting to hold nginx hostage ars technica i fin']",techsupport - techsupport techsupport - tech - active - nginx - ha - india - techsupport techsupport techsupport - isoftwareshop - indian,1.0,False,66362,52232,2019-12-12 20:59:57
gift card redemption scam number works as of 3 53pm est the location of this number is in oklahoma they ll immediately tell you of the gift card redemption offer and ask for your information i e name and address one of the ladies even suggest the name i gave was fake i,-1,-1_student_loan_student loan_got,"['student', 'loan', 'student loan', 'got', 'fake', 'support', 'free', 'just', 'voicemail', 'apple']","['student loan scam so i got a voicemail from sarah the message is as follows hi my name is sarah i ve been trying to reach you regarding your federal student loans your loan has been flagged for forgiveness approval which could eli', 'student loan scam just got a voicemail from julie with student loan enrollment program the message is as follows hi i m julie with the student loan enrollment program i wanted to contact you regarding the class action lawsuit agains', 'student loan scam just got a voicemail from julie with student loan enrollment program the message is as follows hi i m julie with the student loan enrollment program i wanted to contact you regarding the class action lawsuit agains']",student - loan - student loan - got - fake - support - free - just - voicemail - apple,0.4209892602937503,False,66363,52231,2019-12-12 20:54:57
amazon_prime scam idiots in bangladesh are trying to run some amazon_prime scam trying to talk to them to figure out the gist of it i ve come to the conclusion that they are complete idiots hit em and hit em hard,12,12_amazon_amazonprime_account_travel,"['amazon', 'amazonprime', 'account', 'travel', 'amazon account', 'robocaller', 'robocaller warning nomorobo', 'robocaller warning', 'warning nomorobo', 'won']","['amazon_prime fake robocall robocaller warning nomorobo from amazon to inform you that your amazon_prime account will be auto renewed for 249 00 from your bank account so enjoy using it as an acco', 'amazon purchase fake amazon purchase 99 robocaller warning nomorobo pay attention this is amazon_prime your amazon_prime it seems your amazon account misused somebody using your amazon account su', 'amazaon charge scam robocaller warning nomorobo call from amazon to inform you that your amazon_prime account will be auto renewed for 249 00 from your bank account so enjoy using it as an account or if y']",amazon - amazonprime - account - travel - amazon account - robocaller - robocaller warning nomorobo - robocaller warning - warning nomorobo - won,1.0,False,66364,52230,2019-12-12 20:47:56
popups,4,4_fake microsoft_fake microsoft pop_microsoft pop_pop,"['fake microsoft', 'fake microsoft pop', 'microsoft pop', 'pop', 'fake', 'microsoft', 'pop fake', 'microsoft pop fake', 'pop fake microsoft', 'pop url']","['fake microsoft pop up url fake microsoft pop up', 'fake microsoft pop up url fake microsoft pop up', 'fake microsoft pop up url fake microsoft pop up']",fake microsoft - fake microsoft pop - microsoft pop - pop - fake - microsoft - pop fake - microsoft pop fake - pop fake microsoft - pop url,1.0,False,66365,52229,2019-12-12 20:46:56
people pretending to be ssa that somebody is trying to steal your identity,2,2_ssa_ssa ssa_indian_fake,"['ssa', 'ssa ssa', 'indian', 'fake', 'ms', 'ssa indian', 'ssa ssa ssa', 'indian fake', 'dea', 'fake ssa']","['ssa scam', 'ssa scam 12 18 19', 'ssa scam a ssa scam']",ssa - ssa ssa - indian - fake - ms - ssa indian - ssa ssa ssa - indian fake - dea - fake ssa,1.0,False,66366,52228,2019-12-12 20:36:30
20 000 of telemarketing robo calls,-1,-1_student_loan_student loan_got,"['student', 'loan', 'student loan', 'got', 'fake', 'support', 'free', 'just', 'voicemail', 'apple']","['student loan scam so i got a voicemail from sarah the message is as follows hi my name is sarah i ve been trying to reach you regarding your federal student loans your loan has been flagged for forgiveness approval which could eli', 'student loan scam just got a voicemail from julie with student loan enrollment program the message is as follows hi i m julie with the student loan enrollment program i wanted to contact you regarding the class action lawsuit agains', 'student loan scam just got a voicemail from julie with student loan enrollment program the message is as follows hi i m julie with the student loan enrollment program i wanted to contact you regarding the class action lawsuit agains']",student - loan - student loan - got - fake - support - free - just - voicemail - apple,0.42558963488946766,False,66367,52227,2019-12-12 20:23:47
microsoft popup scam link appears to be a working number of an indian tech_support call center,3,3_microsoft popup_popup_appears working_appears,"['microsoft popup', 'popup', 'appears working', 'appears', 'techsupport center', 'working indian', 'indian techsupport center', 'working indian techsupport', 'appears working indian', 'indian techsupport']","['microsoft popup scam link appears to be a working number of an indian tech_support call center', 'microsoft popup scam link appears to be a working number of an indian tech_support call center microsoft popup scam', 'microsoft popup scam link appears to be a working number of an indian tech_support call center']",microsoft popup - popup - appears working - appears - techsupport center - working indian - indian techsupport center - working indian techsupport - appears working indian - indian techsupport,1.0,True,66368,52226,2019-12-12 19:58:39
student loan scam this is another new one hi this is arthur davis following up concerning your student loan debt forgiveness application it is thursday morning december the 12 we can t reach you so we re going to have to terminate t,-1,-1_student_loan_student loan_got,"['student', 'loan', 'student loan', 'got', 'fake', 'support', 'free', 'just', 'voicemail', 'apple']","['student loan scam so i got a voicemail from sarah the message is as follows hi my name is sarah i ve been trying to reach you regarding your federal student loans your loan has been flagged for forgiveness approval which could eli', 'student loan scam just got a voicemail from julie with student loan enrollment program the message is as follows hi i m julie with the student loan enrollment program i wanted to contact you regarding the class action lawsuit agains', 'student loan scam just got a voicemail from julie with student loan enrollment program the message is as follows hi i m julie with the student loan enrollment program i wanted to contact you regarding the class action lawsuit agains']",student - loan - student loan - got - fake - support - free - just - voicemail - apple,0.7286295999044236,False,66369,52225,2019-12-12 19:38:48
adaross scam site list 12 12 2019 size 15 messages here will be posted automatically as the automated system finds popups size b size 12 please do not adaross when replying size b,11,11_size_adaross_size adaross_adaross replying,"['size', 'adaross', 'size adaross', 'adaross replying', 'finds', 'automatically automated finds', 'automated finds popups', 'automated finds', 'adaross site list', 'automatically automated']","['adaross scam site list 12 03 2019 size 15 messages here will be posted automatically as the automated system finds popups size b size 12 please do not adaross when replying size b', 'adaross scam site list 12 02 2019 size 15 messages here will be posted automatically as the automated system finds popups size b size 12 please do not adaross when replying size b', 'adaross scam site list 12 06 2019 size 15 messages here will be posted automatically as the automated system finds popups size b size 12 please do not adaross when replying size b']",size - adaross - size adaross - adaross replying - finds - automatically automated finds - automated finds popups - automated finds - adaross site list - automatically automated,1.0,False,66370,52224,2019-12-12 19:35:56
adaross scam site list 12 12 2019 size 15 messages here will be posted automatically as the automated system finds popups size b size 12 please do not adaross when replying size b,11,11_size_adaross_size adaross_adaross replying,"['size', 'adaross', 'size adaross', 'adaross replying', 'finds', 'automatically automated finds', 'automated finds popups', 'automated finds', 'adaross site list', 'automatically automated']","['adaross scam site list 12 03 2019 size 15 messages here will be posted automatically as the automated system finds popups size b size 12 please do not adaross when replying size b', 'adaross scam site list 12 02 2019 size 15 messages here will be posted automatically as the automated system finds popups size b size 12 please do not adaross when replying size b', 'adaross scam site list 12 06 2019 size 15 messages here will be posted automatically as the automated system finds popups size b size 12 please do not adaross when replying size b']",size - adaross - size adaross - adaross replying - finds - automatically automated finds - automated finds popups - automated finds - adaross site list - automatically automated,1.0,False,66371,52223,2019-12-12 19:35:34
active tech_support refund scammers they ve been active since yesterday,6,6_techsupport_techsupport techsupport_tech_active,"['techsupport', 'techsupport techsupport', 'tech', 'active', 'nginx', 'ha', 'india', 'techsupport techsupport techsupport', 'isoftwareshop', 'indian']","['fake mcafee support scammer from india geek kart com innovative sale vizpc com isoftwareshop com alphasaleweb com thanks my indian friend monis for his help i got these fro', 'heeeey yooooou guuuuuys ah ha ha nginx is often found as the server running that supplies these tech_support scam pages russian media group rambler attempting to hold nginx hostage ars technica i fin', 'heeeey youuuu guuuuys ah ha ha nginx is often found as the server running that supplies these tech_support scam pages russian media group rambler attempting to hold nginx hostage ars technica i fin']",techsupport - techsupport techsupport - tech - active - nginx - ha - india - techsupport techsupport techsupport - isoftwareshop - indian,0.2600627741716902,False,66372,52222,2019-12-12 19:20:37
microsoft popup scam link appears to be a working number of an indian tech_support call center,3,3_microsoft popup_popup_appears working_appears,"['microsoft popup', 'popup', 'appears working', 'appears', 'techsupport center', 'working indian', 'indian techsupport center', 'working indian techsupport', 'appears working indian', 'indian techsupport']","['microsoft popup scam link appears to be a working number of an indian tech_support call center', 'microsoft popup scam link appears to be a working number of an indian tech_support call center microsoft popup scam', 'microsoft popup scam link appears to be a working number of an indian tech_support call center']",microsoft popup - popup - appears working - appears - techsupport center - working indian - indian techsupport center - working indian techsupport - appears working indian - indian techsupport,1.0,True,66373,52221,2019-12-12 19:20:21
microsoft popup i just got the red warning page that wouldn t let me click away for a bit i called the number and right away got connected to a scammer this is my first time posting here so sorry if i m submitting this wrong,10,10_popup_image_popup microsoft_microsoft popup microsoft,"['popup', 'image', 'popup microsoft', 'microsoft popup microsoft', 'png', 'popup microsoft popup', 'microsoft', 'microsoft popup', 'screenshot', 'image screenshot']","['microsoft popup scam link', 'dating app chat image screenshot 135517png png image screenshot 135526png png', 'romance scammer jean image screenshot 115148png png image screenshot 115156png png']",popup - image - popup microsoft - microsoft popup microsoft - png - popup microsoft popup - microsoft - microsoft popup - screenshot - image screenshot,1.0,False,66374,52220,2019-12-12 18:58:24
